azureuser@reverse-node-sandbox:~$ tshark -r capture.pcap -Y 'ip.addr == 38.92.47.118 || ip.addr == 165.140.86.173 || ip.addr == 103.70.115.38' \
  -T fields -e frame.time -e ip.src -e ip.dst -e tcp.port -e udp.port -e frame.len -e _ws.col.Info
Apr 22, 2025 13:13:07.518774000 UTC     10.0.0.4        38.92.47.118    59252,1244              80      59252 → 1244 [SYN] Seq=0 Win=64240 Len=0 MSS=1460 SACK_PERM TSval=3622618935 TSecr=0 WS=128
Apr 22, 2025 13:13:07.597997000 UTC     38.92.47.118    10.0.0.4        1244,59252              80      1244 → 59252 [SYN, ACK] Seq=0 Ack=1 Win=65535 Len=0 MSS=1460 WS=256 SACK_PERM TSval=2813334082 TSecr=3622618935
Apr 22, 2025 13:13:07.598037000 UTC     10.0.0.4        38.92.47.118    59252,1244              72      59252 → 1244 [ACK] Seq=1 Ack=1 Win=64256 Len=0 TSval=3622619014 TSecr=2813334082
Apr 22, 2025 13:13:07.599080000 UTC     10.0.0.4        38.92.47.118    59252,1244              148     GET /s/bc7f301710f4 HTTP/1.1
Apr 22, 2025 13:13:07.679354000 UTC     38.92.47.118    10.0.0.4        1244,59252              303     HTTP/1.1 200 OK  (text/html)
Apr 22, 2025 13:13:07.679402000 UTC     10.0.0.4        38.92.47.118    59252,1244              72      59252 → 1244 [ACK] Seq=77 Ack=232 Win=64128 Len=0 TSval=3622619095 TSecr=2813334164
Apr 22, 2025 13:13:07.679846000 UTC     38.92.47.118    10.0.0.4        1244,59252              72      1244 → 59252 [FIN, ACK] Seq=232 Ack=77 Win=2097408 Len=0 TSval=2813334164 TSecr=3622619015
Apr 22, 2025 13:13:07.698155000 UTC     10.0.0.4        38.92.47.118    59252,1244              72      59252 → 1244 [FIN, ACK] Seq=77 Ack=233 Win=64128 Len=0 TSval=3622619114 TSecr=2813334164
Apr 22, 2025 13:13:07.775934000 UTC     38.92.47.118    10.0.0.4        1244,59252              72      1244 → 59252 [ACK] Seq=233 Ack=78 Win=2097408 Len=0 TSval=2813334261 TSecr=3622619114
Apr 22, 2025 13:13:08.782081000 UTC     10.0.0.4        38.92.47.118    59256,1244              80      59256 → 1244 [SYN] Seq=0 Win=64240 Len=0 MSS=1460 SACK_PERM TSval=3622620198 TSecr=0 WS=128
Apr 22, 2025 13:13:08.865191000 UTC     38.92.47.118    10.0.0.4        1244,59256              80      1244 → 59256 [SYN, ACK] Seq=0 Ack=1 Win=65535 Len=0 MSS=1460 WS=256 SACK_PERM TSval=2813335345 TSecr=3622620198
Apr 22, 2025 13:13:08.865229000 UTC     10.0.0.4        38.92.47.118    59256,1244              72      59256 → 1244 [ACK] Seq=1 Ack=1 Win=64256 Len=0 TSval=3622620281 TSecr=2813335345
Apr 22, 2025 13:13:10.415415000 UTC     10.0.0.4        38.92.47.118    59256,1244              148     GET /s/bc7f301710f4 HTTP/1.1
Apr 22, 2025 13:13:10.495918000 UTC     38.92.47.118    10.0.0.4        1244,59256              303     HTTP/1.1 200 OK  (text/html)
Apr 22, 2025 13:13:10.495950000 UTC     10.0.0.4        38.92.47.118    59256,1244              72      59256 → 1244 [ACK] Seq=77 Ack=232 Win=64128 Len=0 TSval=3622621912 TSecr=2813336979
Apr 22, 2025 13:13:10.496271000 UTC     38.92.47.118    10.0.0.4        1244,59256              72      1244 → 59256 [FIN, ACK] Seq=232 Ack=77 Win=2097408 Len=0 TSval=2813336981 TSecr=3622621832
Apr 22, 2025 13:13:10.536405000 UTC     10.0.0.4        38.92.47.118    59256,1244              72      59256 → 1244 [ACK] Seq=77 Ack=233 Win=64128 Len=0 TSval=3622621953 TSecr=2813336981
Apr 22, 2025 13:13:11.052126000 UTC     10.0.0.4        38.92.47.118    59256,1244              72      59256 → 1244 [FIN, ACK] Seq=77 Ack=233 Win=64128 Len=0 TSval=3622622468 TSecr=2813336981
Apr 22, 2025 13:13:11.130274000 UTC     38.92.47.118    10.0.0.4        1244,59256              72      1244 → 59256 [ACK] Seq=233 Ack=78 Win=2097408 Len=0 TSval=2813337615 TSecr=3622622468
Apr 22, 2025 13:13:17.786939000 UTC     10.0.0.4        165.140.86.173  47472,1243              80      47472 → 1243 [SYN] Seq=0 Win=64240 Len=0 MSS=1460 SACK_PERM TSval=677251143 TSecr=0 WS=128
Apr 22, 2025 13:13:17.804829000 UTC     10.0.0.4        165.140.86.173  47476,1243              80      47476 → 1243 [SYN] Seq=0 Win=64240 Len=0 MSS=1460 SACK_PERM TSval=677251161 TSecr=0 WS=128
Apr 22, 2025 13:13:17.873488000 UTC     165.140.86.173  10.0.0.4        1243,47472              80      1243 → 47472 [SYN, ACK] Seq=0 Ack=1 Win=65535 Len=0 MSS=1460 WS=256 SACK_PERM TSval=583614768 TSecr=677251143
Apr 22, 2025 13:13:17.873526000 UTC     10.0.0.4        165.140.86.173  47472,1243              72      47472 → 1243 [ACK] Seq=1 Ack=1 Win=64256 Len=0 TSval=677251230 TSecr=583614768
Apr 22, 2025 13:13:17.883256000 UTC     165.140.86.173  10.0.0.4        1243,47476              80      1243 → 47476 [SYN, ACK] Seq=0 Ack=1 Win=65535 Len=0 MSS=1460 WS=256 SACK_PERM TSval=583614786 TSecr=677251161
Apr 22, 2025 13:13:17.883296000 UTC     10.0.0.4        165.140.86.173  47476,1243              72      47476 → 1243 [ACK] Seq=1 Ack=1 Win=64256 Len=0 TSval=677251239 TSecr=583614786
Apr 22, 2025 13:13:18.381485000 UTC     10.0.0.4        165.140.86.173  47472,1243              161     47472 → 1243 [PSH, ACK] Seq=1 Ack=1 Win=64256 Len=89 TSval=677251738 TSecr=583614768
Apr 22, 2025 13:13:18.389051000 UTC     10.0.0.4        165.140.86.173  47476,1243              161     47476 → 1243 [PSH, ACK] Seq=1 Ack=1 Win=64256 Len=89 TSval=677251745 TSecr=583614786
Apr 22, 2025 13:13:18.500845000 UTC     165.140.86.173  10.0.0.4        1243,47472              72      1243 → 47472 [ACK] Seq=1 Ack=90 Win=2097408 Len=0 TSval=583615404 TSecr=677251738
Apr 22, 2025 13:13:18.516576000 UTC     165.140.86.173  10.0.0.4        1243,47476              72      1243 → 47476 [ACK] Seq=1 Ack=90 Win=2097408 Len=0 TSval=583615420 TSecr=677251745
Apr 22, 2025 13:13:19.962748000 UTC     165.140.86.173  10.0.0.4        1243,47472              105     1243 → 47472 [PSH, ACK] Seq=1 Ack=90 Win=2097408 Len=33 TSval=583616866 TSecr=677251738
Apr 22, 2025 13:13:19.962779000 UTC     10.0.0.4        165.140.86.173  47472,1243              72      47472 → 1243 [ACK] Seq=90 Ack=34 Win=64256 Len=0 TSval=677253319 TSecr=583616866
Apr 22, 2025 13:13:19.967510000 UTC     10.0.0.4        165.140.86.173  47472,1243              83      47472 → 1243 [PSH, ACK] Seq=90 Ack=34 Win=64256 Len=11 TSval=677253324 TSecr=583616866
Apr 22, 2025 13:13:20.048056000 UTC     165.140.86.173  10.0.0.4        1243,47472              72      1243 → 47472 [FIN, ACK] Seq=34 Ack=101 Win=2097408 Len=0 TSval=583616951 TSecr=677253324
Apr 22, 2025 13:13:20.048151000 UTC     10.0.0.4        165.140.86.173  47472,1243              83      47472 → 1243 [PSH, ACK] Seq=101 Ack=35 Win=64256 Len=11 TSval=677253404 TSecr=583616951
Apr 22, 2025 13:13:20.048172000 UTC     10.0.0.4        165.140.86.173  47472,1243              72      47472 → 1243 [FIN, ACK] Seq=112 Ack=35 Win=64256 Len=0 TSval=677253404 TSecr=583616951
Apr 22, 2025 13:13:20.125953000 UTC     165.140.86.173  10.0.0.4        1243,47472              66      1243 → 47472 [RST, ACK] Seq=35 Ack=112 Win=0 Len=0
Apr 22, 2025 13:13:20.125982000 UTC     165.140.86.173  10.0.0.4        1243,47472              66      1243 → 47472 [RST] Seq=35 Win=0 Len=0
Apr 22, 2025 13:13:22.685541000 UTC     103.70.115.38   10.0.0.4        52170,22                66      52170 → 22 [SYN] Seq=0 Win=1024 Len=0
Apr 22, 2025 13:13:22.685576000 UTC     10.0.0.4        103.70.115.38   22,52170                64      22 → 52170 [SYN, ACK] Seq=0 Ack=1 Win=64240 Len=0 MSS=1460
Apr 22, 2025 13:13:22.884737000 UTC     103.70.115.38   10.0.0.4        52170,22                66      52170 → 22 [RST] Seq=1 Win=1200 Len=0
Apr 22, 2025 13:13:23.682823000 UTC     103.70.115.38   10.0.0.4        38954,22                80      38954 → 22 [SYN] Seq=0 Win=64240 Len=0 MSS=1460 SACK_PERM TSval=227903967 TSecr=0 WS=128
Apr 22, 2025 13:13:23.682861000 UTC     10.0.0.4        103.70.115.38   22,38954                80      22 → 38954 [SYN, ACK] Seq=0 Ack=1 Win=65160 Len=0 MSS=1460 SACK_PERM TSval=296626652 TSecr=227903967 WS=128
Apr 22, 2025 13:13:23.891108000 UTC     103.70.115.38   10.0.0.4        38954,22                72      38954 → 22 [ACK] Seq=1 Ack=1 Win=64256 Len=0 TSval=227904173 TSecr=296626652
Apr 22, 2025 13:13:23.891108000 UTC     103.70.115.38   10.0.0.4        38954,22                95      Client: Protocol (SSH-2.0-libssh_0.11.1)
Apr 22, 2025 13:13:23.891158000 UTC     10.0.0.4        103.70.115.38   22,38954                72      22 → 38954 [ACK] Seq=1 Ack=24 Win=65152 Len=0 TSval=296626860 TSecr=227904173
Apr 22, 2025 13:13:23.895940000 UTC     10.0.0.4        103.70.115.38   22,38954                114     Server: Protocol (SSH-2.0-OpenSSH_9.6p1 Ubuntu-3ubuntu13.9)
Apr 22, 2025 13:13:24.092992000 UTC     103.70.115.38   10.0.0.4        38954,22                72      38954 → 22 [ACK] Seq=24 Ack=43 Win=64256 Len=0 TSval=227904376 TSecr=296626865
Apr 22, 2025 13:13:24.093020000 UTC     10.0.0.4        103.70.115.38   22,38954                1192    Server: Key Exchange Init
Apr 22, 2025 13:13:24.094181000 UTC     103.70.115.38   10.0.0.4        38954,22                1208    Client: Key Exchange Init
Apr 22, 2025 13:13:24.134403000 UTC     10.0.0.4        103.70.115.38   22,38954                72      22 → 38954 [ACK] Seq=1163 Ack=1160 Win=67072 Len=0 TSval=296627104 TSecr=227904377
Apr 22, 2025 13:13:24.288005000 UTC     103.70.115.38   10.0.0.4        38954,22                120     Client: Elliptic Curve Diffie-Hellman Key Exchange Init
Apr 22, 2025 13:13:24.288041000 UTC     10.0.0.4        103.70.115.38   22,38954                72      22 → 38954 [ACK] Seq=1163 Ack=1208 Win=67072 Len=0 TSval=296627257 TSecr=227904573
Apr 22, 2025 13:13:24.304580000 UTC     10.0.0.4        103.70.115.38   22,38954                564     Server: Elliptic Curve Diffie-Hellman Key Exchange Reply, New Keys
Apr 22, 2025 13:13:24.499498000 UTC     103.70.115.38   10.0.0.4        38954,22                88      Client: New Keys
Apr 22, 2025 13:13:24.499914000 UTC     103.70.115.38   10.0.0.4        38954,22                116     Client:
Apr 22, 2025 13:13:24.499925000 UTC     10.0.0.4        103.70.115.38   22,38954                72      22 → 38954 [ACK] Seq=1655 Ack=1268 Win=67072 Len=0 TSval=296627469 TSecr=227904784
Apr 22, 2025 13:13:24.499952000 UTC     10.0.0.4        103.70.115.38   22,38954                116     Server:
Apr 22, 2025 13:13:24.695919000 UTC     103.70.115.38   10.0.0.4        38954,22                148     Client:
Apr 22, 2025 13:13:24.709533000 UTC     10.0.0.4        103.70.115.38   22,38954                116     Server:
Apr 22, 2025 13:13:24.904806000 UTC     103.70.115.38   10.0.0.4        38954,22                124     Client:
Apr 22, 2025 13:13:24.904806000 UTC     103.70.115.38   10.0.0.4        38954,22                72      38954 → 22 [FIN, ACK] Seq=1396 Ack=1743 Win=69504 Len=0 TSval=227905189 TSecr=296627679
Apr 22, 2025 13:13:24.909314000 UTC     10.0.0.4        103.70.115.38   22,38954                72      22 → 38954 [FIN, ACK] Seq=1743 Ack=1397 Win=67072 Len=0 TSval=296627878 TSecr=227905189
Apr 22, 2025 13:13:25.106783000 UTC     103.70.115.38   10.0.0.4        38954,22                72      38954 → 22 [ACK] Seq=1397 Ack=1744 Win=69504 Len=0 TSval=227905391 TSecr=296627878
Apr 22, 2025 13:18:10.386428000 UTC     165.140.86.173  10.0.0.4        1243,47476              99      1243 → 47476 [PSH, ACK] Seq=1 Ack=90 Win=2097408 Len=27 TSval=583907284 TSecr=677251745
Apr 22, 2025 13:18:10.386471000 UTC     10.0.0.4        165.140.86.173  47476,1243              72      47476 → 1243 [ACK] Seq=90 Ack=28 Win=64256 Len=0 TSval=677543743 TSecr=583907284
Apr 22, 2025 13:18:10.386942000 UTC     10.0.0.4        165.140.86.173  47476,1243              99      47476 → 1243 [PSH, ACK] Seq=90 Ack=28 Win=64256 Len=27 TSval=677543743 TSecr=583907284
Apr 22, 2025 13:18:10.506184000 UTC     165.140.86.173  10.0.0.4        1243,47476              72      1243 → 47476 [ACK] Seq=28 Ack=117 Win=2097408 Len=0 TSval=583907405 TSecr=677543743
azureuser@reverse-node-sandbox:~$